post_id,subreddit,title,body,author,created_utc,score
1jqq7oh,NeutralPolitics,What is the lowest tariff that Trump has applied in yesterday’s announcement?,"I don’t want to discuss the pros/cons of the tariffs, or why they may or may not have been applied to specific countries - that subject has been done to death already. But there is one very specific thing I’m not clear on.

[Several news outlets](https://www.bbc.com/news/articles/c1jxrnl9xe2o.amp) in my country are reporting a “10% baseline tariff” that applies to all imports.

[Other news outlets](https://news.sky.com/story/amp/us-seems-content-to-cosy-up-to-russia-instead-of-coerce-it-with-tariffs-13341300) are reporting that Russia (and others) have been “spared” the tariffs.

These two seem at odds with each other. The first implies that Russia is subject to (at least) 10% tariffs. The second implies that Russia is subject to no tariffs at all.

So my question ought to have a very simple answer. Which of these implications is correct? Is Russia subject to 10% tariffs, or 0% tariffs?",LondonPilot,1743705048,59
1jq3q1v,NeutralPolitics,What are the goals and legality of US President Trump's 'Liberation Day' tariffs?,"**Background**

Today, the US President [announced tariffs](https://www.axios.com/2025/04/02/trump-tariffs-april-2-liberation-day) on 76 countries (49 plus the European Union), bringing the average effective US tariff rate to the [highest since 1872.](https://budgetlab.yale.edu/research/fiscal-economic-and-distributional-effects-20-broad-tariff)

This is a two-part question. 

**Goals?**

First, what are the goals of the tariffs? 

In the announcement, Trump said, ""We will supercharge our domestic industrial base, we will pry open foreign markets and break down foreign trade barriers."" 

I can see a certain kind of logic in the first point there. If imported goods become more expensive, it stands to reason that at least *some* production would move to domestic facilities. For example, 18 car companies already [have plants in the US.](https://en.wikipedia.org/wiki/List_of_automobiles_manufactured_in_the_United_States) If their imported models are subject to higher tariffs, they could theoretically shift production of those to US sites. Is that feasible? I don't really understand how tariffs pry open foreign markets.

The announced tariffs also claim to pursue ""fairness"" and ""rebalancing"" in trade. What's the evidence that US trade is unfair and imbalanced now?

Are those the main goals of this policy shift and is there historical precedent for tariffs achieving them? 

**Legality?**

My second question is about the legality of this action. 

The US Constitution explicitly [grants the Congress,](https://constitutioncenter.org/the-constitution/articles/article-i#article-section-8) not the President, the power to levy duties. 

In the [executive order](https://www.whitehouse.gov/presidential-actions/2025/04/regulating-imports-with-a-reciprocal-tariff-to-rectify-trade-practices-that-contribute-to-large-and-persistent-annual-united-states-goods-trade-deficits/) announcing today's moves, Trump claims authority under the [International Emergency Economic Powers Act,](https://en.wikipedia.org/wiki/International_Emergency_Economic_Powers_Act) which authorizes the president to regulate international commerce after declaring a national emergency in response to any unusual and extraordinary threat to the country. What is the threat on which the president is declaring a national emergency?

The order also claims authorities under the ""section 604 of the [Trade Act of 1974,](https://en.wikipedia.org/wiki/Trade_Act_of_1974) as amended (19 U.S.C. 2483), and section 301 of title 3, United States Code."" Is today's action a covered or typical use of those extra-legislative authorities?",nosecohn,1743637978,361
1jo1ugv,NeutralPolitics,Is there a date or deadline for the Supreme Court responding to Trump's Alien Enemies Act request?,"The last update I can find is that Trump did, or said he would, take the use of the Alien Enemies Act to the Supreme Court (ie: reaching over the current decision of Judge Boasberg to stay the AEA deportations).

I thought I had heard a date when we might hear back from the Supreme Court. But, then I do not see that again when I search news stories.

Does anyone know if there is a date, deadline, or calendar on the Supreme Court responding to Trump's request?

Thanks for any information or articles.

Kind regards,

Ki-Wilder

[https://www.npr.org/2025/03/28/nx-s1-5343611/trump-appeals-alien-enemies-act-scotus](https://www.npr.org/2025/03/28/nx-s1-5343611/trump-appeals-alien-enemies-act-scotus)",Ki-Wilder,1743423635,75
1jm3trc,NeutralPolitics,In what ways are/aren't the Trump administration's tariffs against Canada justified?,"This is a slight reworking of a submission by /u/VordovKolnir.

----

https://globalnews.ca/news/11094267/canada-election-2025-begins/

After replacing Trudaeu, Mark Carney called for general elections to receive ""a strong mandate to stand up to U.S. President Donald Trump’s threats and negotiate 'the best deal for Canadians.'”

Since 2020, the U.S. trade deficit with Canada has grown considerably, hitting $54 billion.

https://worldpopulationreview.com/country-rankings/us-trade-deficit-by-country

However, some experts blame US imports of oil from Canada as the chief reason this is the case.

https://globalnews.ca/news/10979652/us-canada-trade-deficit-explained-history-trump/

They also note that if we remove the oil from the equation, it is Canada who has a trade deficit.

Is removing oil from the equation appropriate? Is it possible to leverage these tariffs as a way to decrease the cost of oil and thereby lower prices as a result?

Overall, to what degree are Trump's justifications for the tariffs valid?",nosecohn,1743191256,4
1qdw8lp,PoliticalDiscussion,Is Trump best understood as reacting to perceived U.S. decline by rejecting the post-war international order?,"I’ve been thinking about how to interpret Trump’s foreign and domestic political behavior, and I’m curious how others view this through a political science or historical lens.
One possible interpretation is that Trump sees the United States as a declining hegemonic power and believes that the existing international order - largely built by the U.S. around alliances, multilateralism, and formal equality between states - no longer serves American primacy. From this perspective, working within that system cannot halt decline, so the alternative becomes disrupting or dismantling it in order to reassert dominance.
If this interpretation holds, then undermining alliances, challenging multilateral institutions, and using coercive or norm-breaking rhetoric are not random or impulsive acts, but part of a broader strategy that rejects liberal internationalism in favor of unilateral power.
Domestically, this raises a further question: if such a strategy conflicts with democratic norms and faces internal resistance, does political science suggest that leaders pursuing it are more likely to weaken democratic institutions or suppress dissent to maintain coherence between foreign and domestic policy?
I’m interested in whether this framework aligns with established theories of hegemonic decline, authoritarian drift, or historical examples of powers responding to perceived loss of status. Are there alternative interpretations that explain Trump’s behavior more convincingly?",Lostinspace125,1768512110,1
1qdah3d,PoliticalDiscussion,Do local elections have a greater impact on everyday life than protests or federal politics?,"I’m interested in discussing whether political energy is often misallocated toward national politics and protests, at the expense of local and state-level engagement.

Many of the policies that directly affect daily life are decided locally. Zoning and housing rules, school funding, policing practices, public transportation, public health measures, and local tax structures are largely shaped by city councils, mayors, school boards, governors, and state legislatures.

Despite this, voter turnout in municipal and local elections is consistently low, while attention and activism tend to concentrate on federal politics and national figures. This creates a situation where highly motivated minorities can have outsized influence over local policy simply because few people participate.

I’m not arguing that protests or federal elections are irrelevant. Rather, I’m questioning whether focusing more attention on local elections and local political organizing would be a more effective way to produce durable policy outcomes.

For those with experience in local government, campaigning, or political science, how would you assess the relative impact of local electoral engagement versus protest-based movements in driving long-term political change?",MentalAdversity,1768453231,39
1qcjkaz,PoliticalDiscussion,Do you think that morals are appliable to politics?,"What is your opinion? Should politicians be pragmatic and care for their country, citizens by any means possible, or should they be restricted by ethican beliefs? I personally think they shouldn't, their duty is to care for citizens of their country, instead of people outside it, do whatever it takes to make lives of the citizens better.",NoDefinition8340,1768385294,0
1qbzilt,PoliticalDiscussion,SCOTUS Retirement(s) in 2026?,"No one can say for certain, but, how likely do you all think it is that Alito and/or Thomas retire this year before the midterms positioning DJT to nominate their replacements while Republicans still control the Senate?",Cessnerd77,1768329911,97
1qbz2mf,PoliticalDiscussion,What should be the standard for going to war?,"Before Bush Jr, my impression was that the standard was not to attack unless attacked. The exceptions were to help out someone who is being attacked or to stop genocide. Not saying this was 100% followed, but that was generally the standard.

Once Bush Jr came in with Iraq, the standard seemed to change to include “pre-emptive war”, where if a country is considered to be a threat, they can be attacked first.

Now with Trump 2.0, it seems like war is justified if the president feels like it. The weak must submit to the strong.

What do you think is the right standard?  Why?

Edit: To clarify, I’m only talking post WW2.",AlexandrTheTolerable,1768328977,41
1qbktog,PoliticalDiscussion,"Where do you personally draw the line between legitimate federal enforcement and government overreach, given strong support for the Second Amendment??","I’m trying to understand how supporters of stronger federal enforcement view the limits of government power. If someone believes a government action is unconstitutional, at what point, if ever, do you think it’s justified for citizens to use force in response, and why?

In light of the recent events in Minnesota, if federal agents are going door-to-door, entering homes, and/or detaining people who haven’t committed violent crimes, how do you think citizens should respond if they believe that action is unconstitutional or abusive? Where do you personally draw the line between enforcing the law and violating civil liberties?",radiocure2,1768288334,72
1qbk8fm,PoliticalDiscussion,What institutional mechanisms currently constrain a sitting president’s influence over federal and state elections in a midterm year?,"I’m trying to understand, in concrete terms, what institutional and legal mechanisms limit a sitting president’s ability to influence federal and state elections, particularly in a midterm year like 2026. This isn’t meant as a prediction, but as an examination of how executive authority interacts with enforcement, courts, state election systems, and legislative oversight.

This year presents some unique realities that shape these constraints:

* The president’s party controls both chambers of Congress and the White House (**trifecta**).
* The Supreme Court is ideologically aligned or generally deferential to executive authority.
* Congress has historically struggled to pass even routine legislation, limiting its ability to act quickly.

Given this context, I’m particularly interested in mechanisms that function *before* elections are certified or investigated afterward. Some questions I’d like to explore:

1. **Federal agencies:** How much can a president direct agencies like the DOJ or DHS in ways that could influence election administration, and which legal or procedural limits are meaningful when Congress is unlikely to act quickly?
2. **State-level election oversight:** How effective are secretaries of state, election boards, and state courts at constraining executive influence, especially if the federal executive has strong partisan alignment?
3. **Norms versus enforceable rules:** Which constraints rely on institutional norms rather than legally binding restrictions, and how resilient are those norms in a year with trifecta control and an aligned Supreme Court?
4. **Accountability mechanisms:** How effective are congressional oversight, inspections, and judicial review at limiting presidential influence in real time when Congress is gridlocked and courts may defer to the executive?
5. **Historical precedent:** Are there examples where these mechanisms actually functioned effectively against a sitting president in midterm elections, particularly under conditions of strong partisan control and limited legislative action?

I’m looking for answers grounded in law, political science, or historical examples, rather than predictions or speculation.",disembodied,1768286228,9
1qb8hs9,PoliticalDiscussion,What is next for voters who did not participate in the 2024 elections?,"Participation in the 2024 election was lower than in 2020 across the board by **19 million** voters. No major partisan coalition increased turnout relative to its 2020 baseline, and every group experienced some degree of voter drop-off. Taken together, this indicates a broad retreat from participation rather than a shift in partisan alignment, and is consistent with dissatisfaction or disengagement in response to the options presented.

For the *Democrats*, the effect was most pronounced, with roughly a **15%** drop-off from their 2020 voters, amounting to on the order of **10–12 million fewer** voters who participated at all in 2024.

When looking at the *Republicans*, the drop-off was smaller, closer to **10–11%** of their 2020 voters, corresponding to roughly **7–8 million fewer** voters compared to Trump’s 2020 coalition.

While per-party nonvoter polling is limited, and most nonvoter research focuses on the roughly one-third of independents who historically participate at lower rates, existing studies still point to a general set of reasons why some people who voted in 2020 did not vote in 2024:

* [Lack of enthusiasm for the candidates or choices available.](https://www.pewresearch.org/politics/2024/12/04/voters-and-nonvoters-experiences-with-the-2024-election/)
Pew Research found that a substantial share of nonvoters said they did not like the candidates or felt unmotivated to participate in the election.

* [Belief that voting would not meaningfully change outcomes.](https://www.pewresearch.org/politics/2024/12/04/voters-and-nonvoters-experiences-with-the-2024-election/)
Pew also reports that many nonvoters cited believing their vote would not make a difference or feeling disengaged from politics as a primary reason for abstaining.

* [Economic dissatisfaction, especially around cost of living.](https://prospect.org/2025/07/21/2025-07-21-bringing-back-nonvoters/)
Post-election polling of people who voted for Biden in 2020 but did not vote in 2024 found that concerns about inflation, housing costs, and economic insecurity were common reasons for disengagement.

* [Leadership or confidence concerns about the Democratic ticket.](https://prospect.org/2025/07/21/2025-07-21-bringing-back-nonvoters/)
The same post-election surveys cited by The American Prospect show that some 2020 Democratic voters who sat out 2024 pointed to doubts about leadership effectiveness or confidence in the campaign as factors in their decision.

*  [General disengagement and political fatigue rather than organized protest voting.](https://prri.org/spotlight/breaking-down-the-differences-between-voters-and-non-voters-in-the-2024-election/?utm_source=chatgpt.com)
Across multiple surveys, nonvoters more often described their decision as disengagement, frustration, or lack of connection to the political system, rather than a deliberate protest strategy.

While it’s still early to draw firm conclusions about long-term trends, the 2025 off-year and special elections showed several instances where Democratic candidates outperformed their 2024 presidential margins in specific contests, and where Democratic control was maintained or expanded in state and local government. For example, Democrats flipped a Pennsylvania state senate seat that Trump carried in 2024, and they held or expanded state trifectas in Virginia and New Jersey. However, these contests had much lower turnout than presidential races and are not directly comparable to national participation levels, so any interpretation about broader re-engagement should be cautious and contextual.

That leaves an open question heading into the 2026 midterms and the 2028 general election: what role will the voters who chose not to participate in 2024 ultimately play? Are these voters temporarily disengaged and therefore likely to return under different conditions, or does the 2024 drop-off point to more persistent disengagement? To what extent can the factors cited in 2024 realistically be addressed through policy outcomes, candidate selection, or campaign strategy, and at what point should continued non-participation be treated as a durable constraint rather than a short-term anomaly?

EDIT: Please try to avoid injecting your own takes on the 2024 election and rather engage in speculative discussion of what we think will happen going back into 2028.",Raichu4u,1768254729,78
1qb4yvf,PoliticalDiscussion,How should the Democratic Primary ideally structure its 2028 primary system?,"In the past, the Iowa Caucuses have kicked off the election season, followed by New Hampshire, followed by Nevada and then South Carolina.

Concerns about the shakiness of Iowa's procedures and reporting in some of the last three open primaries plus representation questions (Iowa and New Hampshire perhaps not representing the demographics of the Party) have pushed this into an open question for 2028.

With the goals seemingly to be both more open for lesser known candidates to rise in popularity and a more representative electorate, in what order or how many dates should there even be for the primary season?",BUSean,1768246950,45
1qarq4w,PoliticalDiscussion,What do you see as the long-term consequences of extreme political polarization and economic inequality in the U.S.?,"It feels like political polarization in the U.S. has reached a point where many people support policies that clearly make their own lives harder, often out of resentment toward groups they see as undeserving or out of loyalty to powerful economic interests. At the same time, inflation, rising costs across industries, and growing inequality are putting real pressure on everyday people, while trust in institutions continues to erode. I’m curious how others see this playing out over the long term. Do these trends eventually force a political or cultural correction, or do they increase the risk of more authoritarian outcomes as fear and division deepen? What historical parallels or current indicators do you think matter most here?",libr8urheart,1768214738,60
1qaiio1,PoliticalDiscussion,What do you think about the new threat against Jerome Powell?,"On Friday, the Department of Justice served the Federal Reserve with grand jury subpoenas, threatening a criminal indictment related to my testimony before the Senate Banking Committee last June. That testimony concerned in part a multi-year project to renovate historic Federal Reserve office buildings. What do you think this new threats against Jerome Powell?",atlantacharlie,1768184177,228
1qag7l0,PoliticalDiscussion,What Would a New Iranian Government Look Like?,"The Internet shutdown in Iran is entering its fourth day as protests continue to rage throughout the country. Iran has previously managed to quell similar protests, such as the Mahsa Amini protests in 2022, and the ""Bloody November"" protests in 2019. So far, it is unclear what the outcome of this latest wave will be.

If these protests successfully lead to Ayatollah Khomeini being removed from power, what comes next? There have been a few widely discussed scenarios:

1. Iran returns to a shahdom, like they had before the Iranian Revolution. This would most likely be a constitutional monarchy. [Reza Pahlavi](https://www.npr.org/2026/01/10/nx-s1-5673238/reza-pahlavi-iran-protests) has been discussed as a possible leader by international experts. He is the son of the former Shah, and has lived most of his life in exile in the United States.
2. Khomeini is replaced with a new supreme leader, and the structure of government remains largely unchanged. This would require the Assembly of Experts to cave to public pressure and use their constitutional authority to remove him, or for Khomeini to willingly abdicate (possibly for fear of his own life) and allow them to appoint someone else.
3. Iran adopts a secular, democratic government. The protests heavily feature progressive politics, so is it possible that **both** the shahdom and revolutionary government will be seen as outdated? There has also been speculation that the United States may get involved, like it did in Venezuela, which could affect the direction the country takes.
4. The army revolts and forms a military dictatorship, most likely because their wages dry up. It is worth noting that many soldiers in Iran make [less than the official minimum wage](https://www.iranintl.com/en/202311074695), and that was before the current economic crisis.

Which of these outcomes do you believe is most likely? Or do you think there are other possibilities?",AgentQwas,1768178113,40
1q8lzd9,PoliticalDiscussion,"Gavin Newsom says that given a choice, American voters would always support strong and wrong over weak and right. Is he correct?","In an Atlantic profile, Newsom listed some problems Democrats had during the 2024 election, including inflation and Israel, but he says the biggest issue is the perception that they are ""weak"". He has since taken to the fight with Republicans through counter-gerrymandering and online Trump-style trolling. Does he have a point here?",75dollars,1767996616,582
1q8ismh,PoliticalDiscussion,What would happen if all the requirements for elected office besides being a citizen were abolished?,"By all I mean all. For President you no longer have to be >35, a *natural-born* citizen, or have not been elected twice. For Senators and Representatives, you no longer have to be >30 and >25. For states and localities that have age requirements for their Governors and Mayors, those go away too. 

The only requirement to run for an elected office is being an American citizen (or a resident corresponding to the respective state and local offices). If this were the case, how would American electoral politics change, and would the changes be seismic or more or less congruent with the status quo?",maybemorningstar69,1767989290,27
1q8hkcw,PoliticalDiscussion,What’s are you thoughts on the Renee Good Situation in Minnesota?,"I’m interested in hearing this sub’s perspective on the situation involving Renee Good in Minnesota and the broader fallout that has followed. Specifically, I’m curious how people are interpreting the initial events, the public and political response afterward, and whether the reaction has been proportionate, justified, or mishandled.

Do you think the coverage and discourse around this situation has been fair and grounded in verified facts, or has it been shaped more by political narratives and social media dynamics? How should state officials, media outlets, and the public balance accountability, due process, and restraint in cases like this?",BigSonDaConquistador,1767986457,137
1q8fuyc,PoliticalDiscussion,What are your thoughts on falling birth rates all around the world?,"At the start of the year I like looking up current birth rates, demographic changes like population growth or decline and median age around the world. For the last few years, especially since COVID, it seems as there are less and less births. 

There are several explanations, be it the cost of living, people having less interest in starting a family due to different life choices, more infertility or an increased use of contraceptions. Some of those explanations lead to one another. 

Those are some of the reasons we see a decline in birth rates currently. On the other side, we'll have the effects that we'll face in the future. Those include high costs in elderly care, increasing retirement ages and to even more political power for the older demographics as they (reasonably) vote for parties that work in their interests. There can also be ""positive"" effects in the further future when the infrastructure is getting less strained with housing prices getting more affordable (hopefully). 

My questions/discussion topics are: Is your country/region currently effected with an aging population? How does it handle it? What are your expectations for the future regarding politics, the economy or society in general? ",throwmeawaylololuwu,1767982651,28
