post_id,subreddit,title,body,author,created_utc,score
1qe0slr,anime_titties,Iran accuses foreign intelligence of being behind protest movement,,ObjectiveObserver420,1768522886,104
1qdnwgg,anime_titties,The Taliban rift at the top of the leadership in Afghanistan,,Tartan_Samurai,1768493935,26
1qdma4z,anime_titties,Junior Polish ruling party invalidates leadership election amid claims of “external interference”,,BubsyFanboy,1768490337,8
1qdgabd,anime_titties,Singapore's opposition leader stripped of title after conviction for lying,,cakeday173,1768473717,159
1qdg56x,anime_titties,Government sends safety handbook to every household in Poland,,BubsyFanboy,1768473187,132
1qdfx0z,anime_titties,Ukraine's new defense minister reveals scale of desertions as millions avoid the draft,,SirLadthe1st,1768472353,1341
1qdf95d,anime_titties,"Japan's main opposition CDPJ, Komeito agree to form new party",,Saltedline,1768469869,33
1qdeitz,anime_titties,Russia Plans New Economics Textbook Reviving Stalin-Era Ideas,,F0urLeafCl0ver,1768467062,0
1qde90l,anime_titties,France announces ban on 10 British anti-migrant activists,,F0urLeafCl0ver,1768466035,271
1qd85vy,anime_titties,ISS astronauts begin journey back to Earth in Nasa’s first ever medical evacuation,,StemCellPirate,1768446517,281
1qctnny,anime_titties,(Cyprus) Body found in Pissouri area during search for missing Russian tycoon,,sweetno,1768412129,16
1qcpqzg,anime_titties,"Poland suffers major cyberattack on power grid, says Russia likely responsible",,BubsyFanboy,1768403479,266
1qcnt6b,anime_titties,Landmark Rohingya genocide case against Myanmar heard at top UN court,,Tartan_Samurai,1768398733,172
1qcmlp1,anime_titties,"Activists say Iran has aired at least 97 coerced confessions from protesters, often after torture",,SirStupidity,1768395498,861
1qckyao,anime_titties,"Pacts, patronage and fear: how Myanmar's junta chief holds on to power",,Naurgul,1768390289,13
1qcjwln,anime_titties,Russia claims 'Antichrist' is targeting Lithuania,,Dizzy_Response1485,1768386564,146
1qcixs4,anime_titties,Sudan’s government returns to capital after nearly 3 years of war,,ObjectiveObserver420,1768382885,141
1qcig8l,anime_titties,Egypt bombs RSF convoy days before Saddam Haftar's Cairo visit,,thinkB4WeSpeak,1768381013,40
1qcgdt7,anime_titties,"ISIS Warns Nigerian Christians to Convert, ‘Spare Their Blood’",,Pecuthegreat,1768373354,120
1qcgdqn,anime_titties,"Over 500 million illicit arms flood West Africa, 40% in Nigeria, says Nigeria’s Defence minister Musa",,Pecuthegreat,1768373347,29
1qce3zr,anime_titties,Japan nears 10% foreign population years ahead of official forecasts,,cambeiu,1768365934,1078
1qcdur7,anime_titties,"The death toll from a crackdown on protests in Iran jumps to at least 2,571, activists say",,GregWilson23,1768365146,385
1qcdo09,anime_titties,Pakistan brewery exporting after near 50-year ban,,SunderedValley,1768364578,33
1qbxyzp,anime_titties,South Korea prosecutors seek death penalty over failed insurrection attempt,,defenestrate_urself,1768326663,999
1qbxeph,anime_titties,Randa Abdel-Fattah: How Adelaide Writers' Week imploded after axing Palestinian author,,digital-didgeridoo,1768325454,219
1qbwcai,anime_titties,"Death toll from Iranian protests surpasses 2,000, activists say, as chaos recalls 1979 revolution",,GregWilson23,1768322662,409
1qbva87,anime_titties,Trump cancel meetings with Iranian officials and tells protesters 'help is on its way',,BabylonianWeeb,1768320356,820
1qbtk64,anime_titties,Law recognising Silesian as regional language in Poland approved by parliament,,BubsyFanboy,1768316457,67
1qbqexs,anime_titties,Marine Le Pen's political fate rests on appeal trial opening in France,,Tartan_Samurai,1768308451,70
1qbp971,anime_titties,"About 2,000 killed in Iran protests, official says",,Ahad_Haam,1768304833,1359
1qbotym,anime_titties,Moldova’s Sandu says she would vote for reunification with Romania,,CourtofTalons,1768303364,34
1qbosj4,anime_titties,Red lines and increasing self-censorship reshape Hong Kong's once freewheeling press scene,,Naurgul,1768303223,5
1qbmw3f,anime_titties,How one woman lures foreign recruits to Russia’s front line in Ukraine,,SnoozeDoggyDog,1768296209,180
1qblff7,anime_titties,"Greenland, Venezuela crises fuel European war economy mega-spend",,cambeiu,1768290592,100
1qble98,anime_titties,Sudan Paramilitary Strike on Southeastern City Kills 27,,thinkB4WeSpeak,1768290469,16
1qbl56p,anime_titties,The Throwing of a Kurdish Female Fighter’s Body From a Height by Syrian Forces,,binyat,1768289493,869
1qbjbvk,anime_titties,"X could 'lose right to self regulate', says Starmer",,Tartan_Samurai,1768283180,499
1qbc8e7,anime_titties,UK Expands Online Safety Act to Mandate Preemptive Scanning of Digital Communications,,OGSyedIsEverywhere,1768263582,318
1qb7k08,anime_titties,Pro-government rallies sweep Iranian cities as Tehran blames foreign terrorism for unrest,,ThevaramAcolytus,1768252661,83
1qb705m,anime_titties,UAE removing its military from Bosaso after angry Somalia ends agreement,,ThevaramAcolytus,1768251418,75
1qb5aoz,anime_titties,Moldova’s Sandu says she would vote for reunification with Romania,,Distinct_Front_4336,1768247656,92
1qb41oq,anime_titties,European Parliament bans Iranian diplomats to avoid 'legitimising the regime',,xland44,1768244972,390
1qb2ynb,anime_titties,UK to accelerate law criminalising creation of sexual deepfakes,,F0urLeafCl0ver,1768242719,223
1qb2a3h,anime_titties,Starlink in the crosshairs: How Russia could attack Elon Musk's conquering of space,,GregWilson23,1768241220,15
1qb18wo,anime_titties,President calls for “Poland without illegal immigrants” at football fan pilgrimage to Catholic shrine,,BubsyFanboy,1768239058,41
1qb0oq4,anime_titties,Polish public administration excludes software from vendors other than Microsoft in public tenders,,Auspectress,1768237846,33
1qb0jol,anime_titties,Duhok Governor Reaffirms Shared Destiny as Foundation Stone Laid for Assyrian Genocide Memorial,,Pecuthegreat,1768237542,9
1qdxjqg,moderatepolitics,Newsom says he is blocking Louisiana's push to extradite doctor accused of mailing abortion pills,,CloudApprehensive322,1768515090,100
1qdsje9,moderatepolitics,House Republican Says He Would ‘Lean Toward’ Impeaching Trump If He Were to Invade Greenland: ‘Would Be the End of His Presidency’,,Remote-Molasses6192,1768503882,315
1qdqvhm,moderatepolitics,Trump Suggests U.S. ‘Shouldn’t Even Have’ November Midterms,,shutupnobodylikesyou,1768500301,600
1qdlcq9,moderatepolitics,Trump threatens to use the Insurrection Act to end protests in Minneapolis,,MCRemix,1768488208,300
1qdkfpp,moderatepolitics,Oglala Sioux Tribe says three tribal members arrested in Minneapolis are in ICE detention,,J-Jarl-Jim,1768486003,249
1qd3tex,moderatepolitics,Senate Republicans defeat Venezuela war powers resolution as Trump pressures 2 GOP senators to flip,,Gloomy_Nebula_5138,1768435098,288
1qd3h0b,moderatepolitics,Trump administration slashes grants for mental health and addiction treatment programs,,CloudApprehensive322,1768434243,149
1qd182o,moderatepolitics,France to send troops to Greenland for joint exercise with several European countries,,CloudApprehensive322,1768428890,288
1qd0yck,moderatepolitics,"ICE says it’s illegal to record agents, but is DHS policy actually unlawful?",,CloudApprehensive322,1768428262,138
1qcwmlh,moderatepolitics,Cuba’s regime is in dire straits,,Partytime79,1768418519,48
1qcvwx1,moderatepolitics,US military action in Iran may begin within 24 hours | The Jerusalem Post,,Numerous-Chocolate15,1768416974,114
1qcv3a0,moderatepolitics,Trump threatens to halt federal money next month not only to sanctuary cities but also their states,,CloudApprehensive322,1768415194,269
1qcsid0,moderatepolitics,Major Management and Performance Challenges Facing the Department of Homeland Security,,Resvrgam2,1768409617,36
1qcqxx9,moderatepolitics,Trump appears to flip someone off at a Ford plant. The White House says it’s ‘appropriate.’,,dr_sloan,1768406199,231
1qcp6tv,moderatepolitics,Immigration Agents Terrified of ICE Backlash After Shooting,,J-Jarl-Jim,1768402176,375
1qby081,moderatepolitics,"'Help is on its way,' Trump tells Iranians as he urges them to keep protesting - live updates",,minetf,1768326736,134
1qbxy4e,moderatepolitics,War Department Launches AI Acceleration Strategy to Secure American Military AI Dominance,,Resvrgam2,1768326611,34
1qbwg6u,moderatepolitics,The Four Stages of AI Integration in Education,,Resvrgam2,1768322895,16
1qbvwuq,moderatepolitics,"More Americans Support Abolishing ICE Than Ever Before, Polling Data Shows",,Aurora_Borealia,1768321730,298
1qbvuj3,moderatepolitics,"Trump threatens ""DAY OF RECKONING & RETRIBUTION"" in Minnesota",,thats_not_six,1768321592,315
1qbu6qn,moderatepolitics,DoJ attorneys resign over decision not to investigate agent in Minneapolis ICE shooting,,J-Jarl-Jim,1768317899,544
1qbsomj,moderatepolitics,New High of 45% in U.S. Identify as Political Independents,,J-Jarl-Jim,1768314343,266
1qbbh93,moderatepolitics,Trump Has Complained About Pam Bondi Repeatedly to Aides,,Numerous-Chocolate15,1768261745,269
1qb5bpa,moderatepolitics,"Former Fed chairs, Treasury chiefs condemn Trump administration's Jerome Powell probe",,Gloomy_Nebula_5138,1768247717,223
1qb4n5r,moderatepolitics,E.P.A. to Stop Considering Lives Saved by Limiting Air Pollution,,CloudApprehensive322,1768246247,160
1qb3uew,moderatepolitics,Mark Kelly v. Pete Hegseth,,thats_not_six,1768244533,182
1qb1ouu,moderatepolitics,Trump announces one-year 10% cap on credit card interest rates,,CloudApprehensive322,1768239986,162
1qb0hpu,moderatepolitics,Lisa Murkowski demands investigation into DOJ's probe of Federal Reserve,,CloudApprehensive322,1768237426,468
1qazre2,moderatepolitics,Trump Regrets Not Seizing Voting Machines After 2020 Election,,reputationStan,1768235849,197
1qavp5f,moderatepolitics,Trump says he might keep Exxon out of Venezuela after CEO called it 'uninvestable',,J-Jarl-Jim,1768226577,261
1qagnka,moderatepolitics,Statement from Federal Reserve Chair Jerome H. Powell,,dr_sloan,1768179246,516
1qaf1yq,moderatepolitics,"Trump’s Venezuela, Greenland Threats Make Canada Fear It's Next",,Gloomy_Nebula_5138,1768175142,113
1qaaabi,moderatepolitics,"Trump briefed on new options for military strikes in Iran, source says",,Numerous-Chocolate15,1768163749,148
1qa4xvn,moderatepolitics,'It's A War' Inside ICE's Media Machine,,thats_not_six,1768151776,167
1q9g5jd,moderatepolitics,"House Votes to Restore Health Subsidies, Raising Hopes of a Deal",,reputationStan,1768080295,172
1q8mo4a,moderatepolitics,Trump says US is making moves to acquire Greenland 'whether they like it or not',,That_Nineties_Chick,1767998260,289
1q8kgj1,moderatepolitics,White House shares video of Minneapolis shooting from ICE officer’s perspective,,awaythrowawaying,1767993085,508
1q8exh7,moderatepolitics,National Park Service will void passes with stickers over Trump's face,,thats_not_six,1767980629,318
1q8axw1,moderatepolitics,GOP lawmakers question Noem’s handling of ICE-related shooting in Minnesota,,J-Jarl-Jim,1767971823,477
1q89ra3,moderatepolitics,"Weekend General Discussion - January 09, 2026","Hello everyone, and welcome to the weekly General Discussion thread. Many of you are looking for an informal place (besides [Discord](https://discord.gg/EJ4qAQu)) to discuss non-political topics that would otherwise not be allowed in this community. Well... ask, and ye shall receive.

General Discussion threads will be posted every Friday and stickied for the duration of the weekend. 

Law 0 is suspended. All other community rules still apply. 

As a reminder, the intent of these threads are for \*casual discussion\* with your fellow users so we can bridge the political divide. Comments arguing over individual moderation actions or attacking individual users are \*not\* allowed.",AutoModerator,1767969082,0
1q871cc,moderatepolitics,Trump cancels ‘second wave of attacks’ against Venezuela after prisoner release,,blitzzo,1767961846,110
1q8432w,moderatepolitics,"Yes, Trump’s Venezuela Moves Are Legal — The president’s actions have hundreds of years of precedent behind them.",,qaxwesm,1767951748,0
1q7qwz0,moderatepolitics,Trump: 'My own morality' is only restraint on global power,,superawesomeman08,1767912922,387
1q7k28u,moderatepolitics,US Senate advances measure curbing Trump's Venezuela war powers,,BeginningAct45,1767897700,339
1q7jvpo,moderatepolitics,"Maduro Is Gone, but Repression in Venezuela Has Intensified",,Cobra-D,1767897308,131
1q7ic4n,moderatepolitics,Favorability Wars: The Democrats catch the GOP,,J-Jarl-Jim,1767894092,97
1q7hpxl,moderatepolitics,Comment by Foreign Ministry Official Spokeswoman Maria Zakharova on certain Western countries’ plans to continue the militarisation of Ukraine,,Resvrgam2,1767892770,32
1q7gz3c,moderatepolitics,Trump says U.S. oversight of Venezuela could last for years,,dr_sloan,1767891162,187
1q6x4kb,moderatepolitics,"Trump proposes massive increase in 2027 defense spending to $1.5T, citing ‘dangerous times'",,gmb92,1767832883,325
1q6stew,moderatepolitics,'You've done enough': Tim Walz preps National Guard as Trump's ICE gets stern ultimatum,,Cobra-D,1767822637,388
1qbtenw,NeutralPolitics,What legal and political impediments exist so as to prevent ICE officers from violating U.S. Citizens’ Constitutional rights?,"In an October 2025 interview on Fox News, Miller, serving as Deputy White House Chief of Staff, responded to comments by Illinois Governor JB Pritzker about potentially prosecuting federal immigration agents under state law. Miller stated: “To all ICE officers, you have federal immunity in the conduct of your duties. And anybody who lays a hand on you or tries to stop you or tries to obstruct you is committing a felony”. \[ https://www.aljazeera.com/news/2025/10/31/fact-check-do-ice-officers-really-have-federal-immunity-in-the-us.\] But qualified immunity provides officials a defense against personal financial liability unless their actions violated ""clearly established statutory or constitutional rights of which a reasonable person would have known"". \[https://lawreview.missouri.edu/clearing-the-hurdle-of-proving-a-clearly-established-right-to-overcome-qualified-immunity/\] Is Miller’s point a good one? What legal and political impediments exist so as to prevent ICE officers from violating U.S. Citizens’ Constitutional rights?",aintnoonegooglinthat,1768316093,46
1q9omh3,NeutralPolitics,How did the sharp increase in unauthorized immigrants from 2021 to 2023 impact U.S. society?,"I recently came across this information: Pew Research found that the number of unauthorized immigrants in the U.S. grew from about 10.5 million in 2021 to roughly 14 million in 2023 — an increase of \~3.5 million.

Here’s the report: [Pew Research￼](https://www.pewresearch.org/race-and-ethnicity/2025/08/21/u-s-unauthorized-immigrant-population-reached-a-record-14-million-in-2023/?utm_source=chatgpt.com)

For context, the total number of unauthorized immigrants stayed relatively stable for about a decade before this recent increase. What demonstrable effects has this increase had on U.S. society?",OldCaterpillar3340,1768102162,206
1q678p6,NeutralPolitics,What are the options for a NATO member state to respond to attack by a fellow NATO member?,"After [the attack on Caracas and abduction of Venezuela's president](https://en.wikipedia.org/wiki/2026_United_States_strikes_in_Venezuela), US officials are [publicly](https://www.nytimes.com/2026/01/04/us/politics/trump-cuba-greenland-colombia.html) [discussing](https://www.nytimes.com/2026/01/05/us/politics/stephen-miller-greenland-venezuela.html) the possibility of similarly enacting regime change in other countries of national interest, including Greenland. However, [Greenland is a territory of Denmark](https://www.nytimes.com/2026/01/05/world/europe/trump-greenland-denmark.html), which is a member of the NATO alliance that also includes the US. American officials have also previously discussed [annexing Canada](https://abcnews.go.com/Politics/trump-canadas-carney-hold-high-stakes-meeting-amid/story?id=121510507), another NATO member.

**If the US attacks a fellow member of NATO, what rights and powers does the North Atlantic Treaty give the defending state to respond to the attack?**

**Is there a procedure for expelling a NATO member?**

**Is there a clear definition of what constitutes an attack?** If the US bombs Nuuk, Copenhagen, or Ottawa and abducts the Prime Minister of Greenland, Denmark, or Canada as it did in Venezuela, would that meet the criteria? What about the US's previously reported [covert influence operations](https://www.dr.dk/nyheder/indland/moerklagt/centrale-kilder-maend-med-forbindelser-til-trump-forsoeger-infiltrere) against Greenland?

**Is there any indication of current NATO members that might take the US's side in a conflict?** The Danish government released a [joint statement](https://stm.dk/statsministeriet/publikationer/faellesudtalelse-om-groenland/) with France, Germany, Italy, Poland, Spain, and the UK asserting Denmark's sovereignty over Greenland, but that leaves [24 NATO members](https://en.wikipedia.org/wiki/Member_states_of_NATO) unaccounted for.

**What are the historical precedents for a member of an alliance attacking a fellow member?**",Epistaxis,1767764738,123
1q1c5f0,NeutralPolitics,"What are the historical precedents and modern economic theories for addressing the ""Productivity-Pay Gap"" given current fiscal pressures?","According to the [Economic Policy Institute](https://www.epi.org/productivity-pay-gap/), since 1979, productivity in the US has grown significantly faster than the pay of typical workers. 

As the US enters an era of increased automation via AI - which the IMF suggests could impact a significant portion of the global workforce - the challenge of ""re-coupling"" productivity and pay becomes more urgent. However, this challenge is complicated by several factors:

* The current [US national debt exceeding $38 trillion](https://www.usdebtclock.org/).
* The need to maintain global competitiveness in the ""AI arms race.""

**My question is:** Are there established economic models (historical or theoretical) that successfully address this divergence without relying on large-scale deficit spending or stifling technological innovation? How have models like the Nordic system or Ordoliberalism handled these specific pressures in the past?

",kmundy,1767294507,57
1ppv7ag,NeutralPolitics,What accounts for the growing partisan divergence over constitutional protections for flag burning in the United States?,"Public opinion on flag burning has become increasingly polarized along partisan lines ([From FSU IGC Databrief)](https://igc.fsu.edu/research-data/protected-yet-unpopular-how-americans-view-flag-burning), despite long-standing Supreme Court rulings holding that the act constitutes protected political speech (e.g., *Texas v. Johnson* \- See [University of Baltimore Law Forum](https://scholarworks.law.ubalt.edu/cgi/viewcontent.cgi?article=1548&context=lf&utm_source=chatgpt.com))

An analysis of nearly 60 nationally representative U.S. surveys conducted between 1989 and 2025 identifies several consistent empirical patterns:

* In recent surveys, roughly two-thirds of respondents favor legal restrictions on flag burning.
* Awareness that flag burning is constitutionally protected has increased substantially since the late 1990s.
* Partisan divergence has widened over time: Democrats have become more likely to support the constitutional protection of flag burning, while Republicans have become less likely to do so.

The analysis aggregates multiple survey questions over time using Stimson’s dyadic ratios algorithm; full question wording, survey sources, and methodological details are available in an online appendix here:

**Question**

What evidence-based explanations have scholars or researchers offered to account for the growing partisan divergence over constitutional protections for flag burning?

In particular:

* What role have elite cues, party realignment, or shifts in partisan conceptions of patriotism or national identity played in shaping attitudes toward this issue?
* How have media framing or political rhetoric been shown to influence partisan separation on expressive but controversial forms of protected speech?",Disastrous-Region-99,1766075479,13
1pptg0z,NeutralPolitics,"What structural and regulatory factors contributed to the divergence of U.S. healthcare spending from OECD peers since 1970, and how has this impacted federal debt?","Since the early 1970s, U.S. healthcare spending per capita has significantly outpaced both inflation and the growth rates of other peer nations (Source:[OECD Health Data](https://data.oecd.org/healthres/health-spending.htm)). Simultaneously, U.S. National Debt grew from \~$370B to over $35T (Source:[Treasury Fiscal Data](https://fiscaldata.treasury.gov/datasets/historical-debt-outstanding/)).

I am seeking an empirical discussion on the following structural constraints:

1. **Supply Bottlenecks:** To what extent did the **Balanced Budget Act of 1997** (Section 4621), which capped federally funded residency slots, contribute to physician labor inelasticity and subsequent pricing power? (Source:[Congress.gov - H.R. 2015](https://www.congress.gov/bill/105th-congress/house-bill/2015))
2. **Incentive Structures:** How does the **Medical Loss Ratio (MLR)**—established by the Affordable Care Act—impact the incentives for private insurers to control total healthcare costs, given that profits are essentially capped as a percentage of total premiums? (Source:[KFF - Explaining the MLR](https://www.kff.org/affordable-care-act/explaining-health-care-reform-medical-loss-ratio-mlr/))
3. **Methodology of Overpayment:** Using **NHEA** data (Source:[CMS.gov](https://www.cms.gov/data-research/statistics-trends-and-reports/national-health-expenditure-data/historical)), if U.S. spending had tracked a baseline of CPI + a 1.7% 'Innovation Premium' (consistent with peer nations), the data correlates with \~$26 trillion of current federal debt. Is this 'Intensity Gap' an accurate metric for evaluating the fiscal impact of healthcare pricing, particularly in light of new efforts like **H.R. 6703?**",kmundy,1766071289,52
1pjin0d,NeutralPolitics,Are stricter regulations on private equity required to ensure patient and healthcare provider welfare?,"Massachusetts **Bill H. 5159**, signed into law in January of this year, aims to regulate **private equity** acquisitions of hospitals and other healthcare providers. Those in favor of this law claim it will help combat the failing of hospitals as well as maintain low malpractice risks. However, those against the bill point out the loosely defined phrasing that leaves the law up to too much interpretation. **Are stricter regulations on private equity required to ensure patient and healthcare provider welfare?**

**More Here:** [https://ace-usa.org/blog/research/research-publichealth/unpacking-h-5159-massachusetts-new-rules-for-private-equity-in-healthcare/](https://ace-usa.org/blog/research/research-publichealth/unpacking-h-5159-massachusetts-new-rules-for-private-equity-in-healthcare/)",ACE-USA,1765410800,21
1pj9pxp,NeutralPolitics,What are the Most Effective Means of Reducing the Debt?,"The US Debt-to-GDP ratio has grown to a level of 120%. [ https://fred.stlouisfed.org/series/GFDEGDQ188S ](https://fred.stlouisfed.org/series/GFDEGDQ188S).

I recently stumbled upon this great resource set up by the Committee for a Responsible Federal Budget that allows you to choose policies to fix the debt: [www.crfb.org/debtfixer](http://www.crfb.org/debtfixer).

What are the most effective ways for lowering the debt and deficit? Which policies and/or broad categories should we begin cutting back on and why?",WJPriddy,1765389958,27
1onphu0,NeutralPolitics,What are the public's vulnerabilities and possible remedies if SNAP benefits lapse and food banks run out of food?,"Trump has decided to [let all SNAP benefits lapse on November 1st despite there are still emergency funding for SNAP remaining](https://www.cbsnews.com/amp/news/food-stamps-snap-benefits-november-2025-government-shutdown/)

[Food banks and pantries across the country are reporting record demand and rising operational costs ](https://www.feedingamerica.org/about-us/press-room/latest-food-bank-survey-finds-majority-food-banks-reporting-increased-demand)

[Inflation, though cooling, continues to strain household budgets, particularly for food and housing.](https://www.theworldstimes.com/how-inflation-continues-to-affect-household-budgets/)


Historically, what happens when even local charitable food network (food banks, pantries) run out of food, when an unprecedented number of households simultaneously lose a portion of their food budget and turn to them for support?  How does the current event unfolding differ from the past?

I’m interested in analyses or expert testimony. If you are involved with a food bank, social service agency, or local government, what strain are you seeing already, and what are you doing right now to prepare for it?",PM_me_Henrika,1762207300,38
