post_id,subreddit,title,body,author,created_utc,score
1qe4fgf,worldnews,"Pakistan-Saudi-Turkey defence deal in pipeline, Pakistani minister says",,ibnarabi07,1768532535,1
1qe4dj2,worldnews,Trump says he supports transitional Palestinian panel in Gaza,,ibnarabi07,1768532405,1
1qe44gq,worldnews,"Indian Sikh woman in Pakistan | ‘I’m broke, being harassed’: Sarabjeet urges former husband to take her back to India",,More_Heart_555,1768531728,9
1qe1suj,worldnews,Kremlin backs Trump claim that Zelenskyy blocks Ukraine peace deal,,jackytheblade,1768525503,145
1qe111u,worldnews,"B.C. and feds sign lumber understanding with China, as province looks beyond U.S.",,SilverDragon1,1768523487,127
1qe0wmg,worldnews,IMF's Georgieva expects board meeting in weeks on $8.1 billion program for Kiev,,Brennenstein,1768523168,20
1qe0oyt,worldnews,"Beijing tells Chinese firms to stop using US, Israeli cybersecurity software",,goldstarflag,1768522630,543
1qe0fpk,worldnews,European nations send additional troops to Greenland as US annexation threats escalate,,goldstarflag,1768521993,457
1qe05fd,worldnews,Britain to boost military reserves by raising maximum call-up age to 65,,The_Sun_is_a_Star,1768521299,207
1qdzs2r,worldnews,"More than 4.7m social media accounts blocked after Australia’s under-16 ban came into force, PM says | Social media ban | The Guardian",,NKE01,1768520402,65
1qdytqt,worldnews,"Europeans quietly shift away from US tech services, share lists of local alternatives",,Little_Protection434,1768518087,4244
1qdysjt,worldnews,Venezuela's acting president vows to continue releasing prisoners detained under Maduro,,leebestgo,1768518017,63
1qdyjcp,worldnews,White House says meeting with Danish officials concluded with a decision to continue 'technical talks on the acquisition of Greenland'. Danish officials disagree.,,fruskydekke,1768517413,315
1qdycnd,worldnews,"LeT Terrorist's Advice To Pakistan Army - 'Terrorism Through Jihad Only Solution to Kashmir', Video Surfaces",,Ecstatic-Outcome5618,1768516977,23
1qdxp2x,worldnews,Iran: Doctor Describes Events Inside Hospital During Crackdown,,hassan543,1768515450,115
1qdxnpx,worldnews,Zelensky pushes back on Trump: Ukraine isn’t ‘stumbling block to peace’,,Heart-Ethereals,1768515364,1944
1qdx8v7,worldnews,María Corina Machado says she presented Trump with her Nobel peace prize medal,,slakmehl,1768514401,492
1qdx731,worldnews,Spanish police break up gang that used swimmers to hide cocaine on ships,,Ok_Employer7837,1768514289,36
1qdwsrx,worldnews,Trump given Nobel Peace medal by Venezuelan opposition leader Machado,,HotPersimessage62,1768513365,17439
1qdwhrs,worldnews,Taiwan will invest $250 billion in U.S. chipmaking under new trade deal,,Majestic-Emu-9823,1768512685,84
1qdw3p0,worldnews,"Activists break into Likud HQ, drop fake money dressed as sheikhs in Qatargate protest",,-Cohen_Commentary-,1768511812,39
1qdw1yp,worldnews,Iran: Massacre of protesters demands global diplomatic action to signal an end to impunity,,nerdose,1768511709,86
1qdvtyw,worldnews,White House shrugs off presence of European troops in Greenland,,SnuggleQueens,1768511228,3945
1qdvm8n,worldnews,World Bank cuts Argentina’s 2026 growth prospects from 4.6% to 4%,,hernannadal,1768510748,46
1qdv9ny,worldnews,Australia social media ban hits 4.7 million teen accounts in first month,,malcolm58,1768509949,412
1qdv259,worldnews,"Iran protests: Authorities demanding large sums for return of protesters' bodies, BBC told",,Heart-Ethereals,1768509472,172
1qduiyd,worldnews,Pentagon moving carrier strike group toward Middle East amid tensions with Iran,,Normal-Actuary5036,1768508251,1239
1qdtich,worldnews,Trump delays Iran strikes as aides and Israel raise concerns,,stealth_ghost,1768505976,663
1qdtc77,worldnews,Kurdish groups attempted Iran-Iraq border breach amid ongoing crackdown,,Leather_Focus_6535,1768505602,48
1qdt2tk,worldnews,Anger in Iceland over incoming US ambassador’s ‘52nd state’ joke,,twotwo_twentytwo,1768505038,13224
1qdszvu,worldnews,Iran warns it will target US military bases if attacked,,perplexed-redditor,1768504861,386
1qdszur,worldnews,Taiwan will invest $250 billion in U.S. chipmaking under new trade deal,,Puginator,1768504860,77
1qdrhcg,worldnews,Gulf states and Turkey urged Trump not to launch strikes against Iran,,AavoKas,1768501582,418
1qdrgjm,worldnews,Europeans send troops to Greenland as Trump presses claim,,3xshortURmom,1768501536,274
1qdrfoa,worldnews,Cuba to accept US aid as Washington warns against interference,,3xshortURmom,1768501483,75
1qdrfgp,worldnews,Greenland minister tearful as she describes ‘intense pressure’ amid Trump’s threats to take territory,,theindependentonline,1768501470,35140
1qdrdpy,worldnews,The Trump-backed Palestinian who wants to push Gaza's rubble into the sea,,3xshortURmom,1768501362,11
1qdr1yq,worldnews,Canada's Carney hails warmer ties with China and signs energy pact,,Ok_Employer7837,1768500682,428
1qdr1uc,worldnews,Israel and Arab Nations Ask Trump to Refrain From Attacking Iran,,Crossstoney,1768500675,137
1qdqy6f,worldnews,"US administration to suspend immigrant visa processing for 75 nations including Brazil, Pakistan and Nigeria",,Own_Pin5680,1768500457,69
1qdqn1r,worldnews,IFCN opposes Trump’s decision to deny visas for European public officials and civil society leaders,,murphystruggles,1768499826,85
1qdo1am,worldnews,The Taliban rift at the top of the leadership in Afghanistan,,Frosty_Dig4148,1768494233,72
1qdnxw2,worldnews,"Saudi Arabia, Qatar, Oman convinced Trump to ‘give Iran a chance:’ Senior Saudi official",,WaivyHairDaemon,1768494026,643
1qdmisb,worldnews,"Canadian dies in Iran at the hands of the authorities, says Ottawa",,Normal-Actuary5036,1768490888,6067
1qdm9f8,worldnews,"Canada, China plot course for more oil, gas and uranium exports",,joe4942,1768490292,215
1qdlv1r,worldnews,ISS crew returns to Earth in first-ever medical evacuation,,pritam_ram,1768489373,122
1qdltrn,worldnews,‘Canada is right in the middle’: What Trump’s Greenland threats mean for Canada,,CTVNEWS,1768489294,1241
1qdllu7,worldnews,US seizes in Caribbean Sea another sanctioned oil tanker it says has ties to Venezuela,,grayfox0430,1768488801,160
1qdlgms,worldnews,Swiss competition regulator investigates Microsoft for price hikes,,BezugssystemCH1903,1768488467,92
1qdkn9g,worldnews,South African lawmaker questions decision to relocate Taiwan office,,Hob-999,1768486509,22
1qe2wo2,news,‘It’s AI blackface’: social media account hailed as the Aboriginal Steve Irwin is an AI character created in New Zealand | Indigenous Australians,,Brilliant-Cause6254,1768528494,322
1qe1cjd,news,Prehistoric wolf’s gut frozen in time reveals an ice age giant,,Brilliant-Cause6254,1768524308,176
1qe0qkk,news,"Matthew McConaughey trademarks ‘All right, all right, all right’ catchphrase in bid to beat AI fakes | Movies",,Brilliant-Cause6254,1768522742,2357
1qdztnp,news,ACLU sues Trump administration over ‘racial profiling and unlawful arrests’ in Minnesota ICE surge,,speedythefirst,1768520506,3246
1qdz48w,news,Mummified cheetahs found in Saudi caves shed light on lost populations,,highpriest3,1768518788,338
1qdx5y3,news,"Wikipedia inks AI deals with Microsoft, Meta and Perplexity as it marks 25th birthday",,netizenbane,1768514215,369
1qdwtsn,news,María Corina Machado says she presented Trump with her Nobel peace prize medal,,AbbreviationsHot7662,1768513429,0
1qdwj1r,news,3 men accused of stealing $10K worth of Pokémon cards arrested,,Warcraft_Fan,1768512764,1660
1qdv98d,news,No. 2 US ICE official Madison Sheahan leaving agency to run for Congress,,chasseur_de_cols,1768509919,14907
1qduz6p,news,NY wind project back on after judge rules against Trump administration,,AudibleNod,1768509284,2749
1qds5zg,news,Verizon to issue $20 credits to customers affected by cell service outage,,igetproteinfartsHELP,1768503083,1019
1qdra37,news,Controversial US study on hepatitis B vaccines in Africa is cancelled,,edmchato,1768501146,108
1qdqp4b,news,ACLU Minnesota files lawsuit against Trump administration alleging constitutional violations,,smkmn13,1768499946,627
1qdqcbp,news,Explosion in the Netherlands injures at least 4 and causes widespread damage,,AudibleNod,1768499181,702
1qdnh5b,news,15 former NCAA players among those charged in alleged scheme to rig basketball games,,timmy6169,1768493020,3824
1qdm57y,news,Father's six children in hospital after ICE agents throw tear gas at their car amidst Minneapolis protests,,speedythefirst,1768490024,35924
1qdlvyo,news,Appeals court reverses decision that freed pro-Palestinian activist Mahmoud Khalil,,igetproteinfartsHELP,1768489430,2510
1qdkti0,news,"1.4 million fewer people enrolled in ACA plans as premiums spike, tax credits expire",,AudibleNod,1768486935,12310
1qdhb2r,news,"Trump administration rolls back $2 billion mental health, addiction grant cuts",,Formergr,1768477275,2619
1qdezmc,news,Astronauts splash down after cutting space station mission short due to a medical issue,,housecatspeaks,1768468846,668
1qdeb6b,news,FIFA says it has received more than 500 million ticket requests for 2026 World Cup,,kananishino,1768466269,0
1qdc8i7,news,"X says Grok, Musk's AI chatbot, is blocked from undressing images in places where it's illegal",,netizenbane,1768458806,3610
1qd9cgo,news,"Federal officer shoots man in the leg in Minneapolis after alleged attack during arrest, DHS says",,FakeOkie,1768449901,8161
1qd7qpz,news,California Gov. Newsom says he's blocking Louisiana's push to extradite doctor accused of mailing abortion pills,,FakeOkie,1768445382,6128
1qd6bvi,news,"US apologizes for mistake in deporting Massachusetts college student, but defends her removal",,geraffes-are-so-dumb,1768441608,22536
1qd64qr,news,"ICE error meant some recruits were sent into field offices without proper training, sources say",,FakeOkie,1768441082,2714
1qd3uq5,news,Iran temporarily closes airspace to most flights,,consulent-finanziar,1768435189,595
1qd3ioz,news,EPA to stop calculating money and lives saved by curbs on air pollution,,speedythefirst,1768434354,2380
1qd2hjr,news,Exclusive: China's customs agents told Nvidia's H200 chips are not permitted,,PrudentComedian2416,1768431870,369
1qd0n56,news,Offshore wind developer prevails in U.S. court as Trump calls wind farms 'losers',,livefreeordont,1768427554,11897
1qcycx6,news,Germany joins European partners with troop deployment to Greenland,,consulent-finanziar,1768422318,13169
1qcy3m9,news,Judge declines to grant TRO request but sets deadlines as Minnesota seeks to stop ‘federal invasion’,,smkmn13,1768421739,835
1qcxiud,news,US supreme court rules Republican can challenge Illinois mail-in ballot law,,speedythefirst,1768420486,2611
1qcxhi1,news,"US, for 1st time in 50 years, experienced negative net migration in 2025: Report",,MyNameCannotBeSpoken,1768420406,22130
1qcx66t,news,"California to investigate xAI over Grok chatbot images, officials say",,DrexellGames,1768419702,5289
1qcwvcy,news,Supreme Court backs Montana police who entered a home without warrant for emergency | CNN Politics,,holdendc,1768419042,2794
1qcvu9q,news,"Widespread Verizon outage prompts emergency alerts in Washington, New York City",,FakeOkie,1768416813,1492
1qcvbnz,news,"ICE in St. Paul: Man roughly detained at gas station, Border Patrol chief jeered in Midway Target",,sweet_pea95,1768415696,823
1qcv6t8,news,Ex-SC Rep. RJ May receives prison sentence after pleading guilty to child sex abuse material charges,,AlfhildsShieldmaiden,1768415406,1386
1qcugp5,news,No immediate court decision on a request to stop the immigration crackdown in Minnesota,,grayfox0430,1768413856,1813
1qcsl5m,news,US posts record $145 billion December deficit as outlays outpace receipts,,HazyDavey68,1768409789,9919
1qcscyw,news,US supreme court rules Republican can challenge Illinois mail-in ballot law | US supreme court | The Guardian,,lunabandida,1768409288,131
1qcrzlr,news,"2025 US home sales stuck at 30-year low as mortgage rates, prices weighed on market",,grayfox0430,1768408490,1054
1qcrthu,news,"US to suspend visa processing for 75 nations, State Department says",,Discarded_Twix_Bar,1768408124,19974
1qcqz1h,news,"Trump administration sends letter wiping out addiction, mental health grants",,Apostrophizer,1768406269,17126
1qcps67,news,FBI raids home of Washington Post reporter in ‘highly unusual and aggressive’ move,,OGSyedIsEverywhere,1768403554,53978
1qcp4q2,news,Free Starlink access for Iran seen as game changer for demonstrators getting their message out,,netizenbane,1768402030,96
1qcopdk,news,Some personnel at key US base in Qatar advised to evacuate amid Iran tensions,,AudibleNod,1768400996,174
1qco21h,news,"Exclusive: Beijing tells Chinese firms to stop using US and Israeli cybersecurity software, sources say",,ArchmageXin,1768399360,3236
1qcng9h,news,"Anti-ICE protester blinded by federal agent during demonstration in Santa Ana, family says",,ewzetf,1768397805,16803
1qe4fuh,politics,Aggressive tactics used on Minneapolis protesters raise concerns about federal officer training,,Economy_Swim_8585,1768532566,3
1qe47tl,politics,Federal immigration agents filmed dragging a woman from her car in Minneapolis,,ChocoboAndroid,1768531980,28
1qe43jb,politics,Why American Students Don’t Protest The Iranian Government,,Imaginary-Dress-1373,1768531663,0
1qe3rt1,politics,"DOJ: Ban on mailing concealable firearms unconstitutional, can’t be enforced",,kootles10,1768530779,29
1qe3nj2,politics,Machado Presents Trump With Nobel Peace Prize,,ModdedDreams,1768530467,8
1qe3kr3,politics,Can Trump Be Duped Into Dropping His Greenland Obsession?,,BulwarkOnline,1768530269,20
1qe3jd9,politics,'Wine moms' are being blamed for the ICE protests. We've heard this one before,,NotEnoughDriftwood,1768530168,25
1qe3j8g,politics,US judge dismisses Justice Department lawsuit seeking California voter details,,Jumpinghoops46,1768530158,27
1qe3af0,politics,Trump accepts Nobel medal from Venezuelan opposition leader Machado,,boxingfan333,1768529502,34
1qe36ep,politics,"European troops in Greenland won’t change Trump’s mind, White House says",,Tennis_bruh,1768529211,29
1qe2zz1,politics,Liberal Wisconsin Supreme Court candidate raises 10 times more than conservative,,prailock,1768528744,119
1qe2ouu,politics,"Medical examiner believes death of man in ICE custody was homicide, recording says",,dheber,1768527916,333
1qe254e,politics,GOP breaks with Trump on credit card interest rate cap proposal,,GoodMornEveGoodNight,1768526422,116
1qe24uv,politics,Minnesota leaders call for calm as protests escalate and Trump intensifies threats,,Bigmacman_,1768526401,69
1qe1sbm,politics,"Bodnar plans Senate run as an independent, and Tester’s apparent support angers Democrats in Montana",,SpaceElevatorMusic,1768525465,18
1qe1pyi,politics,22 candidates are running in Georgia to succeed Marjorie Taylor Greene in Congress,,InterlockingBrain,1768525294,39
1qe1i7t,politics,Critics Say Trump ‘Joke Healthcare Plan’ Nothing But a ‘Con’ of the American People,,unital_subalgebra,1768524728,164
1qe1ezv,politics,Humanities Endowment Awarding Millions to Western Civilization Programs,,GoodMornEveGoodNight,1768524485,10
1qe151u,politics,Maine officials expecting ICE operations soon,,jediporcupine,1768523777,89
1qe1333,politics,Transcript: Mike Johnson’s Gaslighting on ICE Takes Truly Vile Turn,,marji80,1768523632,337
1qe125s,politics,"ACLU Sues Federal Government to End ICE, CBP’s Practice of Suspicionless Stops, Warrantless Arrests, and Racial Profiling of Minnesotans",,RollSafer,1768523567,282
1qe1228,politics,Trump administration announces 'major sporting event' exemptions from US visa ban,,Expensive-Horse5538,1768523560,30
1qe115r,politics,Michigan judge threatens warrant after Bay City man misses jail date following viral Minnesota rally appearance,,RaskyBukowski,1768523494,22
1qe0zoa,politics,Majority of Americans say ICE agent’s shooting of Good was unjustified and inappropriate; ICE making cities less safe,,ILikeNeurons,1768523392,942
1qe0xxf,politics,"Trump announces ""The Great Healthcare Plan,"" but it's sparse on details",,GigiL4,1768523264,31
1qe0s2a,politics,Reagan-Appointed judge says Trump admin 'failed' to protect Constitution,,Adventurous_Row3305,1768522847,1077
1qe0oc7,politics,Press secretary says Trump was joking when he said to cancel the midterms,,kootles10,1768522585,71
1qe0nol,politics,Trump threatens to use Insurrection Act and deploy military in Minnesota,,TelescopiumHerscheli,1768522539,50
1qe0aq6,politics,"Clintons say Comer is 'lying with impunity' about Epstein inquiry, release written declarations",,SnooAvocados2794,1768521654,219
1qe06xh,politics,"Talarico leads Crockett in Texas Senate primary, according to new poll",,Zipper222222,1768521402,67
1qe034d,politics,Lawsuit alleges Kyrsten Sinema used campaign funds for affair with security detail,,BertramPotts,1768521144,832
1qdzxtx,politics,How much money President Trump and his family have made : Planet Money,,usmcosuanon,1768520790,149
1qdzul4,politics,Venezuelan Opposition Leader Presents Her Nobel Peace Prize to Donald Trump at White House,,JKKIDD231,1768520569,13
1qdzhnl,politics,European troops arrive in Greenland,,GoodMornEveGoodNight,1768519701,480
1qdz93g,politics,The US wants to remake Venezuela’s oil industry. History stands in the way,,NEWHIGHFLY,1768519115,25
1qdz4pb,politics,Secretary Noem Says She Discussed Insurrection Act With President Trump,,OkayButFoRealz,1768518816,240
1qdz3yl,politics,"10 candidates, 1 issue: Breaking down the Calif. governor's race",,sfgate,1768518769,4
1qdyz3i,politics,ICE deputy director resigns to run for Congress in Ohio,,MiamiPower,1768518443,47
1qdyxr2,politics,Kristi Noem says people should be prepared to prove US citizenship,,Historical-Bug-4784,1768518352,1169
1qdyuth,politics,Homeland Security wants to know who's anonymously posting about ICE,,AerialDarkguy,1768518154,98
1qdypwp,politics,"Medical examiner believes death of man in ICE custody was homicide, recording says | A fellow detainee says he witnessed Geraldo Lunas Campos being choked to death by guards at an ICE detention center in Texas on Jan. 3",,Rock-n-roll-Kevin,1768517843,5928
1qdyne5,politics,Joe Gebbia is reshaping the government in Trump’s image. Trump decimated the U.S. government’s digital design agencies and replaced them with a personal propaganda czar.,,_fastcompany,1768517673,35
1qdyhsu,politics,Congress steps up fight against Trump’s brutal aid cuts,,One_Membership_5324,1768517313,53
1qdyhny,politics,"As LGBTQ+ people go back into the closet under Trump, the Human Rights Campaign reveals plan to fight back",,Fickle-Ad5449,1768517303,76
1qdyg4p,politics,Machado presented Trump with her Nobel award at White House meeting,,Uberubu65,1768517204,0
1qdydlw,politics,Trump Says U.S. ‘Shouldn’t Even Have an Election’ as He Threatens Insurrection Act,,rollingstone,1768517036,353
1qdybgg,politics,US Chamber CEO Warns Frustrated Voters Turning From Capitalism,,bloomberggovernment,1768516899,159
1qdy9oy,politics,Trump promised ‘Liberation Day’ was to bring back manufacturing jobs – but they have dipped every month since,,ChiGuy6124,1768516786,256
1qdy984,politics,Trump Gleefully Seizes Nobel Peace Prize From Real Winner,,Tennis_bruh,1768516755,5111
1qdy89m,politics,‘Absolutely no detail’: experts alarmed as Trump unveils healthcare plan,,mmccxi,1768516693,131
1qe4dhl,PoliticalHumor,What I think of when I see pics of that ICE goon in his silly Nazi coat.,,tonycomputerguy,1768532402,1
1qe4be5,PoliticalHumor,TrumpArtica,,Chuck57a,1768532246,1
1qe45ev,PoliticalHumor,The world is theirs,,Decommoditized,1768531800,3
1qe3r2e,PoliticalHumor,TWO MORE YEARS! (OC),,DAT_DROP,1768530723,1
1qe3la4,PoliticalHumor,Me winning the Nobel Peace Prize today,,Flowersniffin,1768530307,31
1qe3hur,PoliticalHumor,El Gato Files,,Content_Meat731,1768530056,3
1qe3g9t,PoliticalHumor,Speaks for itself.,,Content_Meat731,1768529939,14
1qe3e1l,PoliticalHumor,"We're from the government, and we're here to help.",,PeterBeacon,1768529770,80
1qe34jd,PoliticalHumor,Republicans are so strong and decisive!,,BestStoogewasLarry,1768529077,10
1qe2myr,PoliticalHumor,Old Greg Bovino and his mangina are coming for your illegals,,algorithmic_fetters,1768527777,35
1qe2dz2,PoliticalHumor,He belonged to the Bears cartel,,Firm_Translator_3256,1768527089,22
1qe1gnk,PoliticalHumor,When we are,,Electronic-Mark,1768524612,46
1qe164h,PoliticalHumor,definition of unreasonable search and seizure,,Electronic-Mark,1768523851,152
1qe0nk5,PoliticalHumor,Can you pass the cognitive test?,,AlanB-FaI,1768522530,206
1qe0huk,PoliticalHumor,Trump would take Bubba to that steel mill.,,NewJerseySwampDragon,1768522134,1991
1qdybw5,PoliticalHumor,Those funds were just resting in my account!,,twojabs,1768516927,144
1qdxnhe,PoliticalHumor,Who will tell him?,,Indubioproreo_Dx,1768515349,343
1qdwmvp,PoliticalHumor,"A ""Turning Point""",,StraightedgexLiberal,1768512996,570
1qdwd5b,PoliticalHumor,Environmental Protection,,jtroye32,1768512390,829
1qdvrzt,PoliticalHumor,Homelander,,M1Garrand,1768511105,168
1qduwzm,PoliticalHumor,Trump agriculture secretary's idea to spend less on diet,,Pleasant_Picture3867,1768509142,605
1qdsnue,PoliticalHumor,Certain subs today…,,Empty_Nestor,1768504139,850
1qdrxl3,PoliticalHumor,ICE Agent with Accent Arrests Man for His Accent.,,Beneficial-Chest-699,1768502564,2101
1qdr9sf,PoliticalHumor,This...,,HoosbinFarteen,1768501130,488
1qdr9cm,PoliticalHumor,Foreign prime minister of Denmark having a smoke after meeting with JD Vance,,McPostyFace,1768501104,0
1qdqwbh,PoliticalHumor,Reverse playboy,,jonsnowsbattlebun,1768500347,209
1qdqlc9,PoliticalHumor,This is LEGEND!,,Beneficial-Chest-699,1768499721,13318
1qdqgps,PoliticalHumor,"Yes, he is, without a doubt and the proof is a noxious smell",,cytherian,1768499445,76
1qdprcw,PoliticalHumor,True,,Landoof-Ladig,1768497960,2945
1qdokv7,PoliticalHumor,Donny Newport on Greenland,,SweetPeaches__69,1768495427,12
1qdo696,PoliticalHumor,Ambiguous,,Propofool-ish,1768494538,643
1qdo59d,PoliticalHumor,Who did it better?,,GSUGinger,1768494477,55
1qdnt9z,PoliticalHumor,You mustn’t leave the table until you finish your Venezuela.,,rcranin018,1768493741,99
1qdnf75,PoliticalHumor,"Stop arguing, get involved",,AdeptnessDry2026,1768492906,72
1qdne2s,PoliticalHumor,"Wow, I can't believe they're reenacting the Battle of Bruma.",,decumos,1768492842,0
1qdncnt,PoliticalHumor,Shovels up for the resistance,,Zen1,1768492761,29
1qdna8s,PoliticalHumor,Only airheads can't see this,,sadmep,1768492609,180
1qdn98w,PoliticalHumor,"Great, thank you. Very helpful…",,fibz,1768492548,0
1qdn5mp,PoliticalHumor,Denmark deploys single troop to Greenland.,,Rex_Mundi,1768492321,4604
1qdm9db,PoliticalHumor,Yes,,nxkjs,1768490288,49
1qdm84a,PoliticalHumor,He wants it all.,,Zooinks,1768490207,17
1qdlyn6,PoliticalHumor,Traditional Conservatives vs Trump Conservatives,,AlanB-FaI,1768489600,5255
1qdklkk,PoliticalHumor,"An old meme, but it checks out..",,Dcajunpimp,1768486403,131
1qdk2cz,PoliticalHumor,Don't be offended!,,Pumuckl4Life,1768485119,287
1qdist4,PoliticalHumor,Trump's Heir Club for Mein,,Jerdarnella,1768481853,6131
1qdhvnf,PoliticalHumor,Maybe more strongly worded letters will do fix things,,8-bit-Felix,1768479113,3154
1qdhmd7,PoliticalHumor,Prove them wrong Donnie... release the unredacted files,,Pleasant_Picture3867,1768478322,1869
1qdbfzv,PoliticalHumor,Alpha cosplay,,bong_cumblebutt,1768456247,351
1qdb3pq,PoliticalHumor,Regime change at The Fed,,AlanB-FaI,1768455147,34
1qdb32i,PoliticalHumor,Double Talking Don,,AlanB-FaI,1768455088,80
1qe46lq,Conservative,Illegal Aliens Cost Texas Hospitals Over $1 Billion in 2025,,x-NoSuchAgency-x,1768531891,2
1qe3j25,Conservative,María Corina Machado presents Nobel Peace Prize medal to president Donald Trump,,Threid,1768530146,129
1qe32c1,Conservative,Do Iranian lives matter?,,Ask4MD,1768528914,13
1qe2ytu,Conservative,A Look Back at New York City’s First Flirtation with Socialism,,Ask4MD,1768528657,6
1qe2xs3,Conservative,Disturbing reason Iran appears to have stopped killing protesters,,Ask4MD,1768528578,12
1qe2wks,Conservative,It's 10 a.m. — Do You Know Where Your Grandma Is? She's Getting Pepper-Blasted by the Feds,,Ask4MD,1768528487,33
1qe1owj,Conservative,US moves military assets to Middle East amid Iran tensions - Fox News,,WillyNilly1997,1768525224,52
1qe1j6z,Conservative,HHS Secretary Kennedy Announces Healthcare Price Clarity,,Ask4MD,1768524803,15
1qe1d3f,Conservative,‘A Massacre Happened’: The 24 Hours That Bloodied Iran — Authorities shut down the internet on Jan. 8. Then the large-scale killings began,,Ask4MD,1768524348,26
1qe1bws,Conservative,Coercion Without Ownership: The Real Trump Playbook on Iran,,Ask4MD,1768524263,9
1qe19w8,Conservative,"Too On Brand: School Purges 1984, Animal Farm, Lord of the Flies, and Others to Promote 'Diversity'",,Ask4MD,1768524122,89
1qe163d,Conservative,Students who were bussed to MN Capitol to protest ICE starting fighting....each other.,,Hank_Scorpio_ObGyn,1768523848,348
1qe0wpf,Conservative,Google's game-changer: How to END the mainstream echo chamber | Blaze Media,,md06john316,1768523174,2
1qe0mi6,Conservative,Human Rights Aren’t “The Property Of The Left”,,HooverInstitution,1768522458,21
1qe0i7x,Conservative,Thomas Sowell: My Experience With Artificial Intelligence,,HooverInstitution,1768522161,4
1qdzz6d,Conservative,Vegan Boom Bites the Dust: Meat Sales Soar As Plant Fads Fade,,ArizonaaT,1768520881,64
1qdzkit,Conservative,"239 illegals found in Michigan county's jury pool in just four months, confirming they're registered to vote",,vampirepomeranian,1768519892,813
